ID,Title,Author,Units,Illustrator,Genre,Publisher,Publication Year,Price,Description,Condition,Condition Description,Format,Features,Language,Topic,Book Series,Type,Narrative Type,Edition,Manufactured,Inscribed,Intended Audience,Vintage,Signed,Pictures,Height,Width,Length,Weight,Weight Minor
131,The Blank Book,Lemony Snicket,1,Brett Helquist,"Journals, diary, personal",Harper Collins,2004,10,"If you've read A Series of Unfortunate Events, then you're no stranger to upsetting and depressing stories. Now with this Blank Book, you can write down your own depressing and upsetting stories! Each page is blank and you will find various quotes from the story scattered throughout. Journal your trauma today! See pictures for more details.",Great,Unused and in good condition. No major wear or tear.,Paperback,,English,"Journal, diary",,Journal,Non-Fiction,,,,"children, teenagers, young adults, adults",,,12,2,7,10,1,2
132,Leaves of Grass The First Edition 1855,Walt Whitman,1,,"Poetry, poems,",Barnes and Noble,1997,12,"A collection of poems by the legendary Walt Whitman. Read and feel things like emotions and happiness, longing, perhaps even dread? You decide! See pictures for more details. Comes with a ribbon bookmark.",Good,Books is in good condition with no major wear or tear.,Hardback,,English,"Poetry, poems",,Poem Book,Non-Fiction,,,,"teenagers, young adults, adults, old adults",,,16,2,7,10,1,13
133,Handicapping Speed The Thoroughbred and Quarter Horse Sprinters,Charles Carroll,1,,"Horse racing, racing, horses, strategy, sports",The Lyons Press,1991,25,"if you've ever stayed up late at night, unable to sleep because of the dread that comes with knowing you have a weak handicapping ability, then this is the book for you. Dread no more, as you read this book and absorb it's many secrets on how to become a better speed handicapper and do great things with your horse pal. See pictures for more details.",Good,"Book is in good condition, no major wear or tear. ",Paperback,,English,"Horse racing, sports, horses",,Guide,Non-Fiction,,,,"teenagers, young adults, adults, old adults",,,17,2,7,10,1,6
134,Everyday Winning,Stanley Drake,1,,"Horse racing, racing, horses, strategy, sports",Stanley Drake,1990,25,"A simple and quick mechanical method to master the art of horse racing. Do you often find yourself sitting alone at the bar, gazing absentmindedly at your drink, wishing you could drown your sorrows, after a tough day of betting and losing on horse races? Well, put that drink down and pick this book up, because Stanley Drake is about to teach you how it's done. Learn the secrets of the game of kings and become the horse race betting master! See pictures for more details.",Good,"Books is aged and does contain writings and notes of the previous owner, but has no missing pages or tears. Book appears to be self-published.",Paperback,,English,"horse racing, gambling, horses",,Guide,Non-Fiction,,,,"young adults, adults, old adults",,,9,2,7,10,0,12
135,Rugrats - Sweet Victory,Sarah Willson,1,Peter Panas,"Children, comedy, adventure",Simon Spotlight,2005,5,Short story about the rugrats trying to ge their hands on some sweet candy! Cardboard like material used to make this book.,Good,Slight signs of aging and a bit of a bend to the book. No major tears or wear.,Hardback,,English,Children,,,Fiction,,,,"children, kids",,,9,2,7,10,0,11
136,Harry Potter and the Sorcerer's Stone,J.K. Rowling,1,Mary Grandpre,"Fantasy, adventure, epic, action",Scholastic,2008,5,The beginning of the wonderful Harry Potter saga! This is where it all starts!,,"Good, signs of wear and usage. See pictures.",Paperback,,English,Magic,,,Fiction,,,,"children, kids, young adults",,,18,2,7,10,1,2
137,Snow White and the Seven Dwarfs,Disney,1,,"Fantasy, fairy tale,",Little Golden Books,2009,10,"The classic beloved tale about Snow White and the Seven Dwarves. Small book, great for little kids!",Good,"Good condition, no major signs of wear and tear.",Hardback,,English,Fairy tale,,,Fiction,,,,"children, kids",,,16,2,7,10,0,10
138,The Right Horse,William Murray,1,,"Horse racing, racing, horses, strategy, sports",Doubleday,1997,25,"Want to learn about horse racing? Perhaps you're tired of losing out on bets? Well pal, this is the book for you! Read this and maybe, just maybe you'll become a master of betting on horse races, which is apparently still a thing.",Good,"Good condition, no major signs of wear and tear.",Hardback,,English,Horse Racing,,,Non-Fiction,,,,"Young adults, adults",,,17,2,7,10,1,8
139,Captain Underpants and the Invasion of the Incredibly Naughty Cafe,Dav Pilkey,1,Dav Pilkey,"Children, superhero, action, adventure, comedy",Scholastic,1999,5,The Third Epic Novel that tells the continuing tale of Captain Underpants! This time the unlikely hero faces off against Cafeteria Ladies from Outerspace! Marvel at the shenanigans and the Flip-o-rama action!,Good,"Good condition, no major signs of wear and tear.",Paperback,,English,Children,,,Fiction,,,,"children, kids",,,10,2,7,10,0,13
140,Corduroy en Espanol,Don Freeman,1,Don Freeman,"Children, fantasy, toys",Puffin Books,1988,10,Un libro para ninos.,Good,,Paperback,,Spanish,Children,,,Fiction,,,,"children, kids",,,18,2,7,10,0,10
141,Curious George and the Puppies,Margret H.A. Rey,,H.A. Rey,"Children, fantasy, animals",Houghton Mifflin Company,1998,12,"Another cute story about the beloved monkey, Curious George and his friend, the Man in the Yellow Suit! Great for little kids!",Good,"Good condition, no major wear or tears.",Paperback,,English,Animals,,,Fiction,,,,"children, kids",,,15,2,7,10,0,10
142,The Berenstain Bears Count Their Blessings,Stan and Jan Berenstain,1,Stan and Jan Berenstain,"children, fantasy, animals",Random House,1995,15,A lovely story about the Berenstain Bears being grateful for their family and lives. Read this to your kids and teach them about being grateful!,Good,"Good condition, no major wear or tears.",Paperback,,English,Animals,,,Fiction,,,,"children, kids",,,16,2,7,10,0,10
143,Disney's Enchanting Tales,Disney,1,Disney,"Children, fantasy, fairy tales",Innovage,2005,20,"A collection of all the major Disney fairy tales such as Snow White, Cinderella, The Lion King, The LIttle Mermaid, Beauty and the Beast, Tarzan, Mulan and so much more! Illustrations right out of the movies. See pictures!",Good,"Good condition, no major wear or tears.",Hardback,,English,Fairy tale,,,Fiction,,,,"children, kids",,,24,2,10,13,5,0
144,The Hidden World of Birthdays,Judith Turner,1,,"Spirituality, Religion, New Age",Simon and Schuster,1999,25,"A fascinating book that can shower you insights about yourself, using your birthday. Of course, this is just one perspective, but the author will share what gems, colors, flowers, stars and spiritual guides can help you along your personal journey. Perhaps this book will speak to you, perhaps not. Only one way to find out. At the very least, it's an entertaining view into the various archetypes that make up our society. See the pictures to get a better idea of what this book contains.",Good,"Book appears to have been exposed to moisture and there is a warping to some pages. However, no pages are missing and book is whole. See pictures.",Hardback,,English,Spirituality,,,Non-Fiction,,,,"Young adults, adults, old adults",,,24,2,7,10,2,6
145,Mi Cocina,Mercedes Sanchez Perez,1,Beatriz de Costa,"Cooking, recipes, recetas, espanol",Estudios Graficos Europeos,2008,10,Recetas para cocinar deliciosa comida de chocolate!,Good,See pictures.,Paperback,,Spanish,Cooking,,,Non-Fiction,,,,"Young adults adults, old adults,",,,22,2,7,10,1,6
147,The Count of Monte Cristo Hardcover,Alexandre Dumas,1,,"Drama, Mystery, Victorian, Suspense",Signet Classics,2005,10,"A classic tale set in the post-Napoleonic era. Edmond Dantes, a young sailor is posed to become captain and marry his beloved, only to be betrayed by his bitter enemies and be sentenced to a life of imprisonment. With the help of his sole companion in prison, he escapes and takes on a new identity as the powerful and mysterious Count of Monte Cristo. ",Good,"Great condition,, no major wear or tear. ",Hardback,,English,Adventure,,Novel,Fiction,,,,"Young adults, adults",,,16,2,7,10,1,3
148,The Girl With the Dragon Tattoo,Stieg Larsson,1,,"Mystery, Detective, Suspense, Drama, Murder, Thriller,",Vintage Books,2009,5,"MIkael Blomkvist, a journalist is hired to investiage the disappearance of a welathy Swedish scion. With the help of Lisbeth Salanderl, the dive deeper and deeper into a web of mysteries and suspense.",Good,"Some writings from previous owner on the first few pages, but book is in otherwise good shape. See pictures!",Paperback,,English,Mystery,,Novel,Fiction,,,,"Young adults, adults",,,16,2,7,10,1,3
149,A Storm of Swords,George R.R Martin,1,,"Fantasy, epic, adventure, action",Bantam Books,2011,5,"The third volume in George R.R Martin's epic Game of Thrones saga. Set after the events of A Clash of Kings, the War of 5 kings is set to come to disastrous end!",Good,"Good condition, no major wear or tears.",Paperback,,English,Fantasy,,Novel,Fiction,,,,"Young adults, adults",,,12,2,7,10,1,11
150,Sleeping Beauty,Maureen Spurgeon,1,Brown Watson,"Fantasy, fairy tale,",Brown Watson,1990,10,"The classic tale about a princess who falls under a wicked spell and is rescued from death from love's true kiss. This is not the Disney version. For one, the evil sorceress is named Carabos not Malificent. Still, quite an interesting read.",Good,"Good condition, no major wear or tears.",Hardback,,English,Fantasy,,Kid's book,Fiction,,,,"Young adults, adults",,,24,2,7,10,0,11
151,The Beatles - A Hard Day's Night,John Burke,1,,"Music, History, Musicians",Dell Publishing,1964,30,"Spend a day with the Beatles in this fantasic novel.Contains 8 pages of exlusive photos from the movie, as well! John, Ringo, George and Paul all fall into different shenanigans and what a whacky time they have! A great read for any hardcore fan.",Good,"Some slight wear and aging, but book is whole and intact. No missing pages or major tears. See pictures!",,,English,Music,,Novel,Fiction,,,,"Young adults, adults",,,14,2,7,10,0,11
152,The Horse and His Boy,C.S. Lewis,1,Pauline Baynes,"Fantasy, epic, adventure, fairy tale",Scholastic,1995,5,"Book 3 of the Chronicles of Narnia. Set during the Golden Age of Narnia, when Peter is High King. Follow the adventures of a boy named Shasta, as he seeks to discover who his real father is!",Good,"Some wear and creasing on cover, but no missing pages. See pictures.",Paperback,,English,Fantasy,,Novel,Fiction,,,,"Young adults, adults",,,18,2,7,10,0,13
153,Nancy Drew - Ghost Stories 1987,Carolyn Keene,1,,"Horror, fantasy, mystery",First Minstrel Books,1987,8,"Six haunting stories! Nancy Drew doesn't believe in ghosts, but there are so many unexplained occurences, that she will soon find herself in her most challenging cases yet!",Good,"Front cover has a tear, but book is whole and no missing pages. See pictures!",Paperback,,English,Mystery,,Novel,Fiction,,,,"Kids, young adults, adults",,,17,2,7,10,0,11
154,The Magician's Nephew,C.S. Lewis,1,Pauline Baynes,"Fantasy, epic, adventure, fairy tale",Scholastic,1995,5,"The first tale in the Chronicles of Narnia.Two friends, Digory and Polly find their way to Narnia, where they encounter talking beasts and the evil sorceress Jadis.",Good,"Slight wear, no missing pages or major tears. See pictures!",Paperback,,English,Fantasy,,Novel,Fiction,,,,"Kids, young adults, children",,,17,2,7,10,0,13
155,Frankenstein,Mary Shelley,1,,"Horror, fantasy, mystery",Oxford University Press,1988,12,"The story about a student of natural philosophy who learns the secret of impoarting life toa create constructed from bones he has collected. This story is not a study of the macabre, but rather a study of ow man uses his power, through science, to manipulate and pervert his own destiny.",Good,"Some wear and aging, but no missing pages or major damages. See pictures!",Paperback,,English,Horror,,Novel,Fiction,,,,"young adults, adults",,,14,2,7,10,0,13
156,The Ominous Omnibus - A Series of Unfortunate Events,Lemony Snicket,1,Brett Helquist,"Children, mystery, suspense, drama",Harper Entertainment,2005,12,This book collects A Series of Unfortunate Events 1-3 and contains a poster inside the book jacket!,Good,"Dust jacket has some wear, but no major tears or damage. See pictures!",Hardback,Dust Jacket,English,Mystery,,Novel,Fiction,,,,"young adults, adults",,,24,2,7,10,2,3
157,Green Eggs and Ham Leapfrog,Dr. Seuss,,Dr. Seuss,"Children, fantasy, comedy, adventure",Leap Frog,2008,5,"The classic Dr. Seuss story, for the Leap Frog device.",,"Good condition, no major wear or tears.",Hardback,,English,Children,,Novel,Fiction,,,,"children, kids",,,15,2,7,10,1,2
158,1984,George Orwell,,,"Drama, suspense, alternate history, dystopia",Signet Classics,1977,8,"A truly horrifying tale about a world where the governments of the world control every facet of our lives. No one is safe under the eyes of Big Brother and the party. The Thought Police, endless propaganda and a continuous re-writing of history. A must read! Learn to think for yourself and speak up!",Good,"Good condition, no major wear or tears.",Paperback,,English,Dystopia,,Novel,Fiction,,,,"young adults, adults",,,12,2,7,10,0,14
159,The Wide Window - A Series of Unfortunate Events,Lemony Snicket,1,Brett Helquist,"Children, mystery, suspense, drama",Scholastic,2001,5,"The third book in the Series of Unfortunate Events. The Baudelaire orphans make their way through a cold and uncaring world, trying to find some semblance of peace, as they try and escape from the clutches of Count Olaf.",Good,"Good condition, no major wear or tears.",Paperback,,English,Mystery,,Novel,Fiction,,,,"young adults, adults",,,15,2,7,10,0,13
160,Treasure Island,Robert Louis Stevenson,1,A.J. McAllister,"Adventure, fantasy, suspense, ",Baronet Books,1989,10,Young JIm Hawkins and his friends set sail for Treasure Island and race to find buried treasure before they are captured by the evil Long John Silver!,Good,"Good condition, no major wear or tears.",Hardback,,English,Adventure,,Novel,Fiction,,,,"young adults, adults",,,17,2,7,10,1,3
161,The Adventures of Huckleberry Finn,Mark Twain,1,,"Adventure, children",Reader's Digest,1989,8,"A tale about a boy named Huckleberry Finn. Be warned, this was written in the old days and contains some pretty racist language. ",Good,"Some writings from previous owner, but book is in otherwise good shape.",Hardback,,English,Adventure,,Novel,Fiction,,,,"young adults, adults",,,15,2,7,10,1,6
162,iDisorder - Understanding Our Obsession with Technology,Larry Rosen,1,,"Educational, philosophy, science, human studies, culture, technology",St. Martin's Press,2012,5,"Are we obsessed with technology? Probably. Larry Rosen has a few things to say about that. He is a doctor, so I guess it's worth reading? I dont know, you be the judge.",Good,"Good condition, no major wear or tears.",Paperback,,English,Technology,,,Non-Fiction,,,,"young adults, adults",,,14,2,7,10,1,3
163,John Keats - Lyric Poems,John Keats,,,Poetry,Dover Publications,1991,15,"A collection of 30 poems by the legendary poet, John Keats.",Good,"Good condition, no major wear or tears.",Paperback,,English,Poetry,,,Fiction,,,,"young adults, adults",,,12,2,7,10,0,8
164,The Carnivorous Carnival - A Series of Unfortunate,Lemony Snicket,1,Brett Helquist,"Children, mystery, suspense, drama",Scholastic,2002,5,The 9th book in the Series of Unfortunate Events. The Baudelaire orphans find themselves in the belly of the beast! Count Olaf has stopped at nothing to pursue them in the hopes of stealing the fortune they are set to inherit. A truly sad and tragic tale. Read it!,Good,"Good condition, no major wear or tears.",Hardback,,English,Mystery,,Novel,Fiction,,,,"young adults, adults",,,15,2,7,10,1,5
165,Dragon of the Red Dawn - Magic Tree House,Mary Pope Osborne,1,Sal Murdocca,"children, adventure, fantasy",Random House,2007,5,"The 37th book in the Magic Tree House saga! Set in Edo, Japan.",Good,"Good condition, no major wear or tears.",Hardback,,English,Fantasy,,Novel,Fiction,,,,"young adults, adults",,,22,2,7,10,1,2
166,"The Golden Guide to Handicapping, Training, Racing",Katcha Goodwon,1,,"horses, raching, horse racing",Westcliff Publications,1990,25,"This book will teach you how to think for yourself and not rely on formulas or numbers. If you want to learn how to train your horse and win in the racing game, then this is the book for you, or so the author claims!",Good,"Good condition, no major wear or tears.",Paperback,,English,Horse Racing,,,Non-Fiction,,,,"young adults, adults",,,14,2,7,10,1,5
167,The Berenstain Bears - Spooky Old Tree,Stan and Jan Berenstain,1,Stan and Jan Berenstain,"mystery, children, suspense, fantasy",Random House,2002,15,A cute story about 3 bears that venture into a spooky old tree and have a frightful adventure.,Good,"Good condition, no major wear or tears.",Hardback,,English,Mystery,,Kid's book,Fiction,,,,"young adults, adults",,,13,2,7,10,0,13
168,Great Expectations,Charles Dickens,1,,"drama, children, britan",Dover Publications,2001,8,"A classic tale about Pip, a young lad accustomed to working hard jobs, who dreams of one day becoming a gentleman.",Good,"Good condition, no major wear or tears.",Paperback,,English,Drama,,Novel,Fiction,,,,"young adults, adults",,,11,2,7,10,1,2
169,The Mummy or Ramses the Damned,Anne Rice,1,,"Mystery, suspense, drama, monsters, fantasy",Ballantine Books,1989,15,"Ramses the Great lives! After drinking the elixir of life, he becomes Ramses the Damned, doomed forever to wander the Earth, desperate to quell hungers that can never be satisfied, - for food, for wine, for women. ",Good,"Good condition, no major wear or tears.",Paperback,,English,Drama,,Novel,Fiction,,,,"young adults, adults",,,19,2,7,10,2,0
170,Slaughter House-Five,Kurt Vonnegut,1,,"War, suspense, drama, comedy",Dell Publishing,1969,12,One of the world's great anti-war books. A sad book without tears centering on the firebombing of Dresden.,Good,"Good condition, some slight wear. See pictures.",Paperback,,English,War,,Novel,Fiction,,,,"young adults, adults",,,13,2,7,10,0,10
171,Grovers Just So-So Stories,Nancy Hall,1,Rick Wetzel,"Children, fantasy, comedy, adventure",Golden Press Book,1992,15,A cute Sesame Street book that tells the story of How a Monster gets his fur and how the friendly Honker got his Honk!,Good,"Good condition, no major wear or tears.",Hardback,,English,Fantasy,,Novel,Fiction,,,,"young adults, adults",,,13,2,7,10,1,2
172,Emerald Fairy Tales,Jane Carruth,1,Mary Dinsdale,"Fairy tales, folk tales, fantasy",Rand McNally and Company,1978,15,"A collection of fairy tales and folk stories: Snow White and the Seven Dwarfs, The White Dove, The Little Drummer Boy, Rumpelstiltskin, Jack the GIant Killer, The Brother and the Sister and Hans and the Little Iron Man",Good,"Good condition, no major wear or tears.",Hardback,,English,Fantasy,,,Fiction,,,,"children, kids",,,24,2,10,13,1,10
173,Princess Collection Love and Friendship Stories,Sarah E. Heller,1,Disney,"Fairy tales, folk tales, fantasy",Disney,1999,15,"A large collection of Disney stories such as: Cinderella, Sleeping Beauty, The Little Mermaid, Beauty and the Beast, Mulan, Dumbo, The Fox and the Hound, A Bug's Life, Bambi, Aladdin, Lion King. See pictures",Good,"Good condtion, some wear on cover and bedazzled jewels from previous owner, but otherwise in good shape. No missing pages. See pictures.",Hardback,,English,Fantasy,,,Fiction,,,,"children, kids",,,24,2,10,13,3,6
174,Alf Summer Camp Adventure,Harry Coe Verr,1,Eldon Doty,"Fantasy, sci fi, family, children",Checkerboard Press,1987,15,"A summer camp adventure with the 80's favorite alien, Alf! Coloful illustrations that depict Alf's summer camp shenanigans! See pictures!",Good,"Good condition, some slight wear and aging. See pictures. No missing pages or major tears.",Paperback,,English,Fantasy,,,Fiction,,,,"children, kids, young adults",,,17,2,7,10,0,11
175,Wait Till the Moon is Full,Margaret Wise Brown,1,Garth Williams,"Fantasy, animals, children, fairy tale",Harper and Row,1988,12,"A cute story about a little raccoon that wants to go outside and see the night sky, but must wait until the moon is full. Beautiful drawings!",Good,"Good condition, no major wear or tears.",Paperback,,English,Fantasy,,,Fiction,,,,"children, kids",,,23,2,7,10,0,11
176,Obi-1 2 3 Galactic Basic Edition,Calliope Glass,1,Katie Cook,"educational, sci fi, children, ",Lucas Film Press,2017,10,Teach your little ones how to count with this cute Star Wars book! NIce drawings and easy to follow words will entertain your kids and give them an unforgettable Star Wars lesson.,Good,"Good condition, no major wear or tears.",Hardback,,English,Sci Fi,,,Fiction,,,,"children, kids",,,17,2,7,10,1,3
177,An Astro-Nutty Adventure,Brian Houlihan,1,Loter Inc,"Educational, sci fi, children, ",Phoenix International Publications,2015,5,Professor Von Drake plans an outerspace adventure with the Mickey Mouse clubhouse gang! Cute book with vivid and colorful illustrations!,Good,"Good condition, no major wear or tears.",Hardback,,English,Sci Fi,,,Fiction,,,,"children, kids",,,15,2,7,10,0,11
178,The Cat in the Hat in English and Spanish,Dr. Seuss,1,Dr. Seuss,"children, comedy, fantasy, adventure, poetry",Random House,1995,10,The classic tale of a pair of children that get into all sorts of trouble with a sentient talking Cat that wears a silly hat. Lots of rhyming ensues.,Good ,"Good condition, no major wear or tears.",Hardback,,English,Fantasy,,,Fiction,,,,"children, kids",,,15,2,7,10,1,2
179,Look Before You Bounce Vol 4 Winnie the Pooh,Ronald Kidd,1,Arkadia Illustration,"children, fantasy, comedy, animals, adventure, educational",Advance Publishers,1996,10,"A fun book about Winnie the Pooh, Tigger and friends that will help your children learn and grow. Easy to read and has beautiful, colorful drawings!",Good ,"Good condition, no major wear or tears.",Hardback,,English,Animals,,,Fiction,,,,"children, kids",,,14,2,10,13,1,3
180,The Runaway Soup and other Stories ,Michaela Muntean,1,Tom Cooke,"children, fantasy, comedy, educational",Golden Press Book,1992,15,"A fun Sesame Street story about Grover cooking a pot of soup, that somehow becomes slightly sentient and grows to the point where it runs away. How will they get the soup back into the pot? If the soup is conscious, is it immortal to eat it? I'm not sure, and the book does not address this issue, as it is for children, but it is defintely something to consider. Beautiful drawings and easy to read sentences for your little ones, while you ponder what it means to be conscious and sentient.",Good ,"Good condition, no major wear or tears.",Hardback,,English,Fantasy,,,Fiction,,,,"children, kids",,,14,2,10,13,1,3
181,Beauty and the Beast The Enchanted Rose,Disney,1,Disney,"children, fantasy, fairy tale,",Leap Frog,2010,5,"The classic Disney tale, in Leap Frog format!",Good,"Good condition, no major wear or tears.",Hardback,,English,Fantasy,,,Fiction,,,,"children, kids",,,15,2,7,10,0,14
182,Growth Spurth Zits Sketchbook 2,Jerry Scott,1,Jim Borgman,"comics, comedy, teenagers",Andrews McMeel Publishing,1999,20,A collection of the 90's comic strips Zits! Super funny and relatable.,Good,"Good condition, some wear and aging. See pictures.",Paperback,,English,Teenagers,,,Fiction,,,,"children, kids, teenagers, young adults, adults",,,22,2,7,10,1,3
183,The Wizard of Oz,L. Frank Baum,1,Thomas Sperling,"fantasy, fairy tales, adventure",Modern Publishing ,2002,10,"The classic tale The Wizard of Oz. Dorothy finds herself in a strange land. With the help of her friends The Scarecrow, Lion and Tin Man, she must make her way to the Emerald Wizards lair and get back to Kansas! Beautifully illustrated!",Good,"Good condition, no major wear or tears.",Hardback,,English,Fantasy,,,Fiction,,,,"children, kids, teenagers, young adults, adults",,,17,2,7,10,1,3
184,The World of Delacroix 1798-1863 Eugene Delacroix,Tom Prideaux,1,Eugene Delacroix,"Art, French Art, Romantic Art, Biography, France",Time Life Library of Art,1966,15,An insightful book that collects various art works of Eugene Delacroix. The author gives an account of Delacroix's life and commentaries on his art style and inspiration. Very beautiful renditions of French Romantic Period artwork. See pictures!,Good,"Good condition, some wear and aging on sleeve cover, but book itself is in great condition. No missing pages or major wear.",Hardback,,English,Art,Time Life Library of Art,Art Book,Non-Fiction,,,,"adults, young adults, teenagers, old adults",,,24,2,11,14,3,2
185,The World of Velazquez 1599-1660 Diego de Silva Velasquez,Dale Brown,1,Diego de Silva Velazquez,"Art, Spanish Art, Baroque Period, Biography, Spain",Time Life Library of Art,1972,15,"A wonderful art book that follows the life and works of the Spanish painter Diego de Silva Velazquez, the leading artist in the court of King Philip IV of Spain and Portugal, and of the Spanish Golden Age. Book contains various of Velazquez' art pieces, as well as a commentary on his life and styles of art work. Beautifully rendered art of the baroque art period. Comes with a book sleeve. See pictures.",,"Good condition, some wear and age on outer book sleeve, but book itself is in great condtion. See pictures.",Hardback,Dust Jacket,English,Art,Time Life Library of Art,Art Book,Non-Fiction,,,,"adults, young adults,",,,24,2,11,14,3,2
