ID,Title,Author,Units,Illustrator,Genre,Publisher,Publication Year,Price,Description,Condition,Condition Description,Format,Features,Language,Topic,Book Series,Type,Narrative Type,Edition,Manufactured,Inscribed,Intended Audience,Vintage,Signed,Pictures,Height,Width,Length,Weight,Weight Minor
1,The Count of Monte Cristo,Alexandre Dumas,1,,"Drama, Mystery, Victorian, Suspense",Bantam Books,1956,3,"Worn and aged, but intact. See pictures for more details.",Good,,Paperback,Dust Jacket,English,Adventure,,Novel,Fiction,,,,"Young Adults, Adults",Yes,,10,2,7,10,1,0
2,Goodnight Moon,Margaret Wise Brown,1,Clement Hurd,"Children, Fantasy, Animals",Harper and Row,1947,15,"Aged, but in good condition.",Good,,Hardback,,English,Playtime,,Kid's book,Fiction,,,,,,,13,2,7,10,1,0
3,"Oh, The Places You'll Go",Dr. Seuss,1,,"Children, Fantasy, Educational, Humor",Random House,1990,10,Minimal wear.,Good,,Hardback,Dust Jacket,English,Poetry,,Kid's book,Fiction,,,,,,,18,2,9,13,0,5
4,Horton Hears A Who!,Dr. Seuss,1,,"Children, Fantasy, Educational, Humor",Random House,1982,7,Book shows signs of wear and writiing on the inside. See pictures.,Good,,Hardback,,English,Poetry,,Kid's book,Fiction,,,,,,,13,2,9,13,1,5
5,The Sneetches and Other Stories,Dr. Seuss,1,,"Children, Fantasy, Educational, Humor",Random House,1989,10,Used but in good condition.,Good,,Hardback,,English,Poetry,,,,,,,,,,12,2,9,13,1,5
6,Green Eggs and Ham,Dr. Seuss,1,,"Children, Fantasy, Educational, Humor",Random House,1988,10,"Good condition, minimal wear.",Good,,Hardback,,English,Poetry,,,,,,,,,,12,2,7,10,1,0
7,Ten Apples Up On Top!,Dr. Seuss as Theo. LeSieg,1,Roy McKie,"Children, Fantasy, Educational, Humor",Random House,1989,7,"Good condition, minimal wear.",Good,,Hardback,,English,Poetry,,,,,,,,,,9,2,7,10,1,0
8,The Cat in the Hat,Dr. Seuss,1,,"Children, Fantasy, Educational, Humor",Random House,1985,12,Great condition. MInimal wear. See pictures for more details.,Good,,Hardback,,English,Children,,,,,,,,,,12,2,7,10,1,0
9,The Little Engine that Could,Watty Piper,1,George and Doris Hauman,"Children, Fantasy, Educational, Humor, Trains, Animals",Platt and Munk,1961,20,"Aged, but intact and in good condition. No pages missing. ",Good,,Hardback,,English,Trains,,,,,,,,,,11,2,7,10,1,0
10,The Mirror Crack'd,Agatha Christie,1,,"Mystery, Detective, Suspense, Drama, Murder, Thriller,",Pocket Books,1964,5,"Worn with signs of aging and slight discoloration, but intact. No missing pages.",Acceptable,,Paperback,,English,Mystery,,,,,,,,,,13,2,7,10,0,12
11,Kids' Book of Gross Facts and Feats,Todd Strasser,1,Donna Reynolds,"Children, Educational, Humor, Animals, Biology, Insects",Watermill Press,1998,3.5,Small tear on front and back cover. Book is intact and in decent condition.,Acceptable,,Paperback,,English,Science,,,,,,,,,,12,2,7,10,0,12
12,Sesame Street - Grover Takes Care of Baby,Emily Thompson,1,Tom Cooke,"Children, Fantasy, Educational, Humor, Trains, Animals, Babies",Little Golden Books,1987,5,Aged with visible signs of wear. Book is intact and no pages are missing.,Good,,Hardback,,English,Learning,,,,,,,,,,11,2,7,10,0,12
13,Star Wars - Little Golden Book Collection,"Courtney Carbone, Christopher Nicholas, Geof Smith",1,"Heather Martinez, Ethen Beavers, Patrick Spaziante, Caleb Meurer, Micky Rose, Chris Kennett, Ron Cohee","Children, Fantasy, Educational, Humor, Sci Fi",Little Golden Books,2016,12,"In good condition, with no major signs of wear and tear. A collection of 7 tales, spanning from Star Wars Episode 1 - 7. ",Good,,Hardback,,English,Sci Fi,,,,,,,,,,13,2,7,10,1,12
14,The Jungle Book,Rudyard Kipling,1,,"Children, Educational, Humor, Animals",Little Golden Books,1967,4,"Aged and worn, but complete and not missing pages. Read this to your children or add to your Disney collection.",Acceptable,,Hardback,,English,Animals,,,,,,,,,,13,2,7,10,0,12
15,101 Dalmatians,Justine Korman,1,Bill Langley and Ron Dias,"Children, Educational, Humor, Animals, Fantasy",Little Golden Books,1991,7,"Signs of aging, but otherwise in good condition. Great for little kids, Disney fans or dog lovers. ",Good,,Hardback,,English,Dogs,,,,,,,,,,13,2,7,10,0,12
16,A Series of Unfortunate Events - The Reptile Room,Lemony Snicket,1,Brett Helquist,"Children, Drama, Mystery, Suspense, Thriller, Young Adult",Harper Collins,1999,4,"Great condition. MInimal wear. If you want to feel things or make your kids appreciate you, this is the series for you! ",Good,,Hardback,,English,Children,,,,,,,,,,8,2,7,10,1,1
17,Junie B. Jones is a Beauty Shop Guy,Barbara Park,1,Denise Brunkus,"Children, Fantasy, Educational, Humor",Random House,1998,3,Worn with light signs of writing on cover. See pictures for more details.,Acceptable,,Paperback,,English,Children,,,,,,,,,,13,2,7,10,0,12
18,Junie B. Jones and the Mushy Gushy Valentime,Barbara Park,1,Denise Brunkus,"Children, Fantasy, Educational, Humor",Random House,1999,4,Worn with light signs of wear and aging. Teach your kids about love and Valentine's Day. See pictures for more details.,Acceptable,,Paperback,,English,Children,,,,,,,,,,13,2,7,10,0,12
19,Junie B. Jones Has a Peep in Her Pocket,Barbara Park,1,Denise Brunkus,"Children, Fantasy, Educational, Humor",Random House,2000,2,Tear on back cover. No pages missing. See pictures for more details.,Acceptable,,Paperback,,English,,,,,,,,,,,10,2,7,10,0,12
20,Bullies Are a Pain in the Brain,Trevor Romain,1,Trevor Romain,"Children, Fantasy, Educational, Humor",Free Spirit Publishing,1997,5,"In good condition, with no major signs of wear and tear. Bullies suck. I think we can all agree. Help your kids learn about how to deal with bullies with this book. Stomp out bullying! See pictures for more details.",Good,,Paperback,,English,,,,,,,,,,,15,2,7,10,0,14
21,Fish!,"Stephen C. Lundin Ph.D., Harry Paul and John Christensen",1,,"Educational, Self Help, Careers, Business",Hyperion,2000,3,Used but in good condition. Missing dust jacket.,Good,,Hardback,,English,,,,,,,,,,,7,2,7,10,1,0
22,The Time Machine and Invisible Man,H.G. Wells,1,,"Fantasy, Sci Fi, Thriller, Drama, Suspense",Signet Classic,1984,5,"Used with signs of wear. 2 great stories from the master, H.G. Wells. See pictures for more details.",Acceptable,,Paperback,,English,,,,,,,,,,,12,2,7,10,0,14
23,The Westing Game,Ellen Raskin,1,,"Adult, Mystery, Murder, Thriller, Suspense",Scholastic,1978,5,Minimal wear with signs of aging. A fun murdery mystery that'll keep you on the edge of your seat. See pictures for more details.,Good,,Paperback,,English,,,,,,,,,,,10,2,7,10,0,14
24,The New Bible Commentary Revised,"D. Guthrie, J.A Motyer, A.M. Stibbs, D.G. Wiseman",1,,"Religion, Christianity, Spirituality, History, Commentary",Guide Posts,1984,12,"Dust jacket included! Signs of aging and slight wear. If you want to learn about the Bible, you can't go wrong with this classic commentary. Expansive and insightful. See pictures for more details.",Good,,Hardback,Dust Jacket,English,,,,,,,,,,,10,3,7,10,0,12
25,Goosebumps - Night of the Living Dummy,R.L. Stine,1,,"Children, Young Adult, Thriller, Humor, Suspense, Scary",Scholastic,1993,7,Signs of wear on front cover and back cover. No pages missing. See pictures for more details.,Acceptable,,Paperback,,English,,,,,,,,,,,13,2,7,10,0,14
26,A Boy at War,Harry Mazer,1,,"Children, Young Adult, Thriller, War, Military, History, Suspense",Scholastic,2001,5,Used and worn. Great story about the perils of war and the loss of innocence. See pictures for more details.,Acceptable,,Paperback,,English,,,,,,,,,,,14,2,7,10,0,12
27,Nancy Drew - Ghost Stories,Carolyn Keene,1,,"Children, Young Adult, Thriller, Suspense, Horror",Aladdin Paperbacks,1983,7,"Used, but in good condition with no major signs of wear. 6 spooky stories to freak out your young children! See pictures for more details.",Good,,Paperback,,English,,,,,,,,,,,11,2,7,10,0,13
28,The Maze Runner,James Dashner,1,,"Young Adult, Suspense, Adventure, Thriller, Sci Fi",Delacorte Press,2009,5,"Used, but in good condition. Excellent story for young adults or kids who love to read. See pictures for more details.",Good,,Paperback,,English,,,,,,,,,,,6,2,7,10,1,2
29,Wayside School Gets A Little Stranger,Louis Sachar,1,,"Children, Fantasy, Educational, Humor",Avon Camelot,1996,7,"Used but in good condition. Some signs of wear. I loved reading these bizarre books when I was a kid. The outlandish scenarios and wackiness always left me in such a good mood, albeit a bit confused. Now you can do the same to your kids! See pictures for more details.",Acceptable,,Paperback,,English,,,,,,,,,,,11,2,7,10,0,13
30,Captain Underpants and the Invasion of the Incredibly Naughty Cafeteria Ladies,Dav Pilkey,1,,"Children, Fantasy, Educational, Humor, Sci Fi",Scholastic,1999,7,"Great condition with very minimal signs of wear. What can I say about Captain Underpants? You just have to read these books to appreciate them. I think as a kid, the silliness and wackiness really resonated with me. The artwork wasn't the best and yet it immersed you in the world of two kids getting into shenanigans with their mean-principal-turned-Super Hero, Captain Underpants. Laughs, comic styling and the good ol' Fliporama pages. Please, you gotta show your kids this, they'll love it! Check out the pictures for more details.",Good,,Paperback,,English,,,,,,,,,,,10,2,7,10,0,14
31,Junie B. Jones - First Grader (At Last!),Barbara Park,1,Denise Brunkus,"Children, Fantasy, Educational, Humor",Scholastic,2002,3,"Used and worn, but in good condition. No pages missing. See pictures for more details.",Good,,Paperback,,English,,,,,,,,,,,7,2,7,10,0,12
32,Nancy Drew and the Clue Crew - Case of the Sneaky Snowman,Carolyn Keene,1,Macky Pamintuan,"Children, Young Adult, Thriller, Suspense, Mystery",Scholastic,2007,5,"Great condition, with minimal signs of wear. Find out who stole Sherlock, Nancy's snowman! See pictures for more details.",Good,,Paperback,,English,,,,,,,,,,,9,2,7,10,0,12
33,Captain Underpants and the Attack of the Talking Toilets,Dav Pilkey,1,,"Children, Fantasy, Educational, Humor, Sci Fi",Scholastic,1999,5,"Slight signs of wear and aging. Your kids will love this book. Lighthearted, silly humor that's perfect for kids who love outlandish characters. Plus, the Fliporama pages! You gotta see it to believe it! Check out the pictures for more details.",Good,,Paperback,,English,,,,,,,,,,,10,2,7,10,0,14
34,Junie B. Jones - Aloha-ha-ha!,Barbara Park,1,Denise Brunkus,"Children, Fantasy, Educational, Humor",Scholastic,2007,3,Used and worn. See pictures for more details.,Acceptable,,Paperback,,English,,,,,,,,,,,12,2,7,10,0,13
35,True Stories of Heavenly Encounters - Where Miracles Happen,Joan Wester Anderson,1,,"Religion, Christianity, Spirituality, History, Commentary",Guide Posts,1994,5,"Dust jacket has signs of wear and a small tear, but has kept the book in good condition. Uplifting stories about miracles and people with a strong faith in God. See pictures for more details.",Good,,Hardback,Dust Jacket,English,,,,,,,,,,,19,2,7,10,1,6
36,MIracles and Other Wonders,Charles Sellier,1,,"Religion, Christianity, Spirituality, History, Commentary",Guide Posts,1994,5,"Dust jacket has signs of wear and a small tear, but has kept the book in good condition. Uplifting stories about miracles and people with a strong faith in God. See pictures for more details.",Good,,Hardback,Dust Jacket,English,,,,,,,,,,,15,2,7,10,1,6
37,Organic Living,Michael Van Straten,1,David Loftus,"Health, Lifestyle, Nature, Food, Educational",Frances Lincoln Unlimited,2001,10,"Dust jacket has signs of wear, but book is in good condition. Great book for learning more about an organic lifestyle and healthy living. Give this to someone you love or buy it and leave it on your coffee table, never to be picked up, except by curious guests, waiting for you to finish getting ready to go out. See pictures for more details!",Good,,Hardback,Dust Jacket,English,,,,,,,,,,,17,2,10,12,2,8
38,Southern Living - The Quick and Easy Cookbook Menus Recipes,Lee Cannon,1,,"Food, Recipes, Cooking, Baking, Tutorial, Educational",Oxmoor House,1979,10,"Used with signs of wear. No missing pages. Do you like Southern food? Comfort food? Eating delicious home cooked meals? Yeah, you do. This is the book for you. Classic recipes, that will leave you watering at the mouth, from just staring at the photographs. Impress your friends and family with your newfound cooking abilities and never tell them the truth: You learned it all from this book. See the pictures for more details.",Good,,Hardback,Dust Jacket,English,,,,,,,,,,,18,2,11,8,2,8
39,How to Avoid Probate with a Revocable Living Trust,Jay M. Barry,1,,"Educational, Finance, Self Help, Money",Homestead Publishing Company,1987,8,"Used and slightly worn. Honestly, the title says it all. If you're looking at this listing, you probably need this book, so just buy it already. See pictures for more details.",Good,,Paperback,,English,,,,,,,,,,,8,2,9,12,1,4
40,Enyclopedia of Estate Planning,Robert S. Holzman,1,,"Educational, Finance, Self Help, Money",Boardroom Classics,1988,10,"Used with slight signs of wear. Do you need to plan your estate? Then give this book a shot, what else do you have to lose? See pictures for more details.",Good,,Hardback,,English,,,,,,,,,,,9,2,10,12,3,2
41,The Family Legal Advisor,Alice K. Helm,1,,"Educational, Finance, Self Help, Money, Law, Legal Help",Ottenheimer Publishers,1978,10,"Used with signs of wear and aging. Great for adding to a large shelf of legal books that you will probably never touch again, but look extremely impressive in an office setting or a home den. Also, it's fun to laugh at outdated information, isnt it? See pictures for more details.",Good,,Hardback,,English,,,,,,,,,,,14,2,10,12,3,14
93,Animorphs - The Exposed,K.A. Applegate,1,David B. Mattingly,"Adventure, fantasy, action, children, young adult",Scholastic,1999,5,Used with some wear and a slight tear on lower front cover. A classic epic series about children with the ability to turn into any animal they touch. Unique cutout cover! See pictures!,Good,,Paperback,,English,,,,,,,,,,,12,2,7,10,0,13
94,Goosebumps - Vampire Breath,R.L. Stine,1,,"Children, Young Adult, Thriller, Humor, Suspense, Scary",Scholastic,2011,5,Used with minimal signs of wear. Enthrall your young children with this tale of a vampire who lurks in a basement. 2010 printing. See pictures.,Good,,Paperback,,English,,,,,,,,,,,6,2,7,10,0,13
95,Goosebumps - Welcome to Camp Nightmare,R.L. Stine,1,,"Children, Young Adult, Thriller, Humor, Suspense, Scary",Scholastic,2010,5,Used with some signs of wear. The 2010 printing. ,Good,,Paperback,,English,,,,,,,,,,,9,2,7,10,0,13
96,A Child Called It,Dave Pelzer,1,,"Drama, tragedy, trauma, true story, abuse, self help",Health Communcations Inc,1995,5,"Great condition. A heart breaking and inspirational story about a child with an iron will, raised by a horrible mother. If you want to cry, you want this book. See pictures.",Good,,Paperback,,English,,,,,,,,,,,6,2,7,10,1,0
97,Harry Potter and the Chamber of Secrets,J.K. Rowling,1,Mary GrandPre,"Adventure, fantasy, action, children, young adult",Scholastic,1999,5,"Used and worn. The 2nd book in one of the best book series to come out of the 90's. Mystery, magic and Quidditch, what more do you need? Either you're a millennial adult like I am and need a replacement copy or you want to gift this to a little kid, you can go wrong with this book. See the pictures for more details.",Good,,Paperback,,English,,,,,,,,,,,9,2,7,10,1,0
42,The Silmarillion,J.R.R Tolkien,1,,"Fantasy, Epic, Adventure, Thriller, Fiction, History",George Allen and Unwin,1977,8,"For the uninitiated, this is basically the Lord of the Rings bible. Tells about the creation of Middle Earth and the various entities involved. If you love Lord of the Rings and you want to go deeper into the lore, you need to read this.",Good,"Good condition, no missing pages or major wear.",Hardback,,English,Fantasy,,Novel,Fiction,,,,"Young Adults, Adults",,,13,2,7,10,1,12
43,High Moment,Wallace Brockway,1,,"History, Educational, Self Help, Motivation, Leaders",Simon and Schuster,1955,10,"This book deal with monumental moments in the lives of great figures such as Jullius Caesar, Napoleon, Socrates, Joan of Arc, Michelangelo, Abraham Lincoln and more.",Good,"Cover has signs of aging, but is in good condition.",Hardback,,English,History,,,Non-Fiction,,,,"Young Adults, Adults",,,20,2,7,10,1,7
44,The Velevteen Rabbit or How Toys Become Real,Margery Williams,1,Michael Green,"Children, fantasy, educational, adventure, animals",Running Press,1981,10,"A cute story about a sentient rabbit and his little boy friend. Also, some toys come to life, but in a fun, non-horror way. ",Good ,"Cover has signs of aging, but is in good condition.",Hardback,,English,Fairy Tale,,Kid's Book,Fiction,,,,"Kids, children",,,14,2,7,10,1,3
45,Vanishing Wildlife of North America,National Geographic Society - Thomas B. Allen,1,David R. Bridge,"Educational, animals, history, wildlife, nature",National Geographic Society,1974,10,"Contains pictures and descriptions of the animals and wildlife that is slowly disappearing from this Earth. Read this and learn about the world around you, tell your friends and family about how we need to take care of nature. See pictures for more details.",Good,In great condition,Hardback,,English,Animals,,,Non-Fiction,,,,"Children, teenagers, young adults, adults",,,18,2,7,10,2,0
46,American Mountain People,"Clay Anderson, Charlton Ogburn, Bill Peterson",1,Bryan D. Hodgson,"History, educational, america, people, pictures",National Geographic Society,1973,8,Learn all about life in the mountains and the various cultures that reside there. Vivid pictures and details!,Good,"Good condition, no missing pages or major wear.",Hardback,,English,America,,,Non-Fiction,,,,"Young Adults, Adults",,,12,2,7,10,2,2
47,America's Magnificent Mountains,"Lous de Haba, Ralph Gray, Sallie M. Greenwood",1,Suez B. Kehl,"History, educational, america, nature, pictures, mountains",National Geographic Society,1980,8,"Really, the title says it all. Amazing pictures of the various magnificent mountains located in the U.S.",Good,"Good condition, no missing pages or major wear.",Hardback,,English,Nature,,,Non-Fiction,,,,"Young Adults, Adults",,,17,2,7,10,2,2
48,Illustrated Dictionary of Chinese Acupuncture,"Zhang Rui-fu, Wu Xiu-fen, Nissi S. Wang",1,,"Medicine, holistic, self help, therapy, history, educational",Sheep's Publications,1985,50,A massive tome that contains translations of explanation on Chinese Acupuncture techniques. Contains helpful diagrams and explanations. Perfect for learning about homeopathic asian medicinal methods.,Good,"Good condition, no missing pages or major wear.",Hardback,,English,Acupuncture,,Guide,Non-Fiction,,,,"Young Adults, Adults",,,24,2,7,10,3,2
49,I Am America (And So Can You!),Stephen Colbert,1,,"Politics, humor, america, celebrity,",Spartina Productions,2007,5,"Stephen Colbert's hilarious and satirical book. If you're familiar with Colbert's work then you'll love this book, if you aren't then you will be deeply confused. Remember, it's satire! ",Good,"Good condition, no missing pages or major wear.",Hardback,Dust Jacket,English,America,,,Non-Fiction,,,,"Young Adults, Adults",,,22,2,7,10,3,0
50,I Ching,Rudolf Ritsema and Stephen Karcher,1,,"Spiritual, oriental, asian, history, culture, occult, metaphysical, divination",Barnes and Noble,1995,8,"The I Ching was a sacred text used by asian cultures for many purposes, to divine the future, to seek guidance in personal crisis, to aid in one's growth and journey throughout this lifetime. This is a thick book with many lessons to share.",Good,Missing dust jacket. In good condition.,Hardback,,English,,,Guide,Non-Fiction,,,,"Adults, young adults, old adults",,,12,2,7,10,3,5
51,The Divine Comedy of Dante Alighieri 3 Paradiso,John D. Sinclair,1,,"History, poetry, spiritual, philosophy, ",Oxford University Press,1961,8,"The 3rd volume in John Sinclair's translation and commentary of Dante's Divine Comedy. If you've every played Dante's Inferno, this is what that game is based off of.",Good,"Good condition, no missing pages or major wear.",Paperback,,English,Spiritual,,Novel,Non-Fiction,,,,"Adults, young adults, old adults",,,13,2,7,10,1,6
52,Analytic Dictionary of Chinese and Sino-Japanese ,Bernhard Karlgren,1,,"Educational, language, asian, chinese, japanese",Dover Publications,1974,15,Great reference book for anyone trying to learn Chinese or Japanese. Contains translations and pictrographs.,Good,"Slight signs of wear, but no missing pages or tears.",Paperback,,English,Language,,Translation Book,Non-Fiction,,,,"Young Adults, Adults",,,24,2,7,10,1,12
53,The Berenstain Bears - Learn to Share,Stan and Jan Berenstain,1,,"Children, Fantasy, Educational, Humor",Reader's Digest,1992,12,Cute book from the 90's. Teach your kids about sharing with the help of the Berenstain Bears!,Good,"Good condition, no missing pages or major wear.",Hardback,,English,Kids,,Kid's Book,Fiction,,,,"Kids, children",,,14,2,7,10,1,2
54,Mysteries of the Ancient World,"Christine K. Ekstrom, Ron Fisher, Louis de la Haba",1,Don A. Sparks,"Spiritual, history, culture, occult, mysteries, mythology, unexplained",National Geographic Society,1979,20,"Learn about the many mysteries of the ancient world. The Giant Easter Island Heads, the Pyramids of Egypt, Forgotten Ruins, and so much more!",Good,"Good condition, no missing pages or major wear.",Hardback,Dust Jacket,English,History,,,Non-Fiction,,,,"Young Adults, Adults",,,24,2,7,10,2,3
55,The Ocean Realm,"Robert D. Ballard, Linda Mc Carter Bridge",1,Thomas B. Powell,"Educational, animals, history, wildlife, nature, marine biology, oceans, seallife",National Geographic Society,1978,10,"Great book about the diverse ecosystem beneath the ocean. From shallow pools to the very depths of the sea, this is a great read for learning more about marine life. Vivid pictures and descriptions!",Good,"Dust jacket has some tears, but hardback is in great condition.",Hardback,Dust Jacket,English,Marine Biology,,,Non-Fiction,,,,"Young Adults, Adults",,,20,2,7,10,2,3
56,The Majestic Rocky Mountains,William S. Ellis ,1,David R. Bridge,"History, educational, america, nature, pictures, mountains",National Geographic Society,1976,8,The title says it all. A book about the majestic Rocky Mountains. Vivid pictures and details.,Good,"Good condition, no missing pages or major wear.",Hardback,,English,Nature,,,Non-Fiction,,,,"Young Adults, Adults",,,16,2,7,10,2,2
57,The Tale of Jemima Puddle-Duck,Beatrix Potter,1,Beatrix Potter,"Children, Fantasy, Educational, Humor",The Penguin Group,1989,10,Small book that tells the story of Jemima Puddle-Duck! Cute illustrations and drawings,Good,"Good condition, no missing pages or major wear.",Hardback,,English,Animals,,,Fiction,,,,"Children, kids",,,9,2,7,10,0,10
58,The Book of King Arthur,Howard Pyle,1,Ron King,"Fantasy, Adventure, Epic, Myth, Fairy Tale",Classic Press,1969,30,"The legendary tale of King Arthur and the mythical sword! Awesome drawings of the various parts of the story. See pictures! Book is aged, but still whole.",Good,"Book is vintage and showing signs of aging, please see pictures! No missing pages.",Hardback,,English,Fantasy,,Novel,Fiction,,,,"Children, kids",,,24,2,10,13,1,11
59,Complete Works of William Shakespeare,"William George Clark, William Aldis Wright",1,,"Shakespeare, poetry, history, commentary, fantasy, tragedy, drama",Grosset and Dunlap,1911,100,"This 112 year old book contains all of Shakespeare's works, poems and plays. Hamlet, The Tempest, The Taming of the Shrew, Macbeth, Romeo and Juliet, you name it, it's in here! See the pictures for more details.",Good,"Signs of aging, but no missing pages or major wear. See pictures.",Hardback,,English,Poetry,,Collection,Non-Fiction,,,,"Young adults, Adults",,,24,2,7,10,2,10
60,Respect for Acting,"Uta Hagen, Haskel Frankel",1,,"Educational, theatre, acting, tutorial, cinema",Macmillan Publishing Co.,1979,10,Learn about the timeless craft of acting. Who needs acting classes when you've got this book? Become a master actor today!,Good,"Slight signs of aging, but in good condition.",Hardback,,English,Acting,,Guide,Non-Fiction,,,,"Adults, young adults, children",,,14,2,7,10,1,6
61,John Keats Complete Poems,"John Keats, Jack Stillinger",1,,"Poetry, history, romance, drama",Belknap Press,1982,15,"A collection of John Keats poems, edited by Jack Stillinger. Fill your brain to the brim with the beautiful words of this literary legend",Good,Used but in good condition.,Paperback,,English,Poetry,,,Fiction,,,,"Young Adults, Adults",,,16,2,7,10,1,12
62,Poems That Live Forever,Hazel Felleman,1,,"Poetry, history, romance, drama",Doubleday and Company,1965,30,"A massive collection of poems from various legendary writers such as Shakespeare, Edgar Allen Poe, Walt Whitman, Henry Wadsworth Longfellow, John Keats, William Butler Yeats and so much more! See pictures for more details.",Good,"Signs of aging, but no missing pages or major wear. See pictures.",Hardback,,English,Poetry,,Collection,Non-Fiction,,,,"Young Adults, Adults",,,22,2,7,10,2,11
63,The Very Hungry Caterpillar,Eric Carle,1,,"Children, Fantasy, Educational, Humor",The World Publishing Company,1973,8,"The classic tale about a hungry caterpillar. Various pages are cut in a way that fits the story, for example the various illustrations of the leaves that the caterpillar eats! Book is quite old and is showing signs of wear and some pages beginning to come loose. See pictures. No missing pages, still intact.",Good,"Signs of aging, but no missing pages or major wear. Certain pages are beginning to come loose, but the book is still whole and intact. Vintage printing.",Hardback,,English,Kids,,,Fiction,,,,"Children, kids",,,24,2,10,13,1,7
